{
  "contract_type": "selection_evidence",
  "contract_version": "0.1",
  "evidence_id": "ev-tavily-paygo-basic-price-20260905",
  "candidate": {
    "provider_id": "tavily",
    "service_id": "tavily/search",
    "interface_id": "tavily/search:https-api",
    "operation": "web.search",
    "interface_digest": "sha256:cccccccccccccccccccccccccccccccccccccccccccccccccccccccccccccccc",
    "service_version": "provider-api-undated",
    "adapter_version": "0.1.0",
    "endpoint": "https://api.tavily.com/search"
  },
  "claim_path": "pricing.search_request",
  "claim": {
    "value": "0.008",
    "unit": "USD/basic-request",
    "value_kind": "currency_estimate",
    "currency": "USD"
  },
  "source": {
    "issuer": "tavily",
    "source_url": "https://docs.tavily.com/documentation/api-credits"
  },
  "method": "producer_declared",
  "observed_at": "2026-09-05T02:00:00Z",
  "fetched_at": "2026-09-05T02:00:05Z",
  "expires_at": "2026-09-12T02:00:00Z",
  "scope": {
    "operation": "web.search",
    "region": "global",
    "account_plan": "pay-as-you-go",
    "task_profile": "basic-search",
    "cache_mode": "default"
  },
  "strength": "declared",
  "status": "current",
  "snapshot": {
    "digest": "sha256:dddddddddddddddddddddddddddddddddddddddddddddddddddddddddddddddd",
    "snapshot_ref": "docs://tavily/api-credits/2026-09-05",
    "retention": "digest_only"
  }
}
