{
  "contract_type": "selection_evidence",
  "contract_version": "0.1",
  "evidence_id": "ev-example-latency-expired",
  "candidate": {
    "provider_id": "example-search",
    "service_id": "example-search/web-search@1",
    "interface_id": "example-search/web-search@1:https-api:basic",
    "operation": "web.search",
    "interface_digest": "sha256:cccccccccccccccccccccccccccccccccccccccccccccccccccccccccccccccc",
    "service_version": "1",
    "adapter_version": "0.1.0",
    "endpoint": "https://api.example.com/search"
  },
  "claim_path": "performance.latency_ms",
  "claim": {"value": 420, "unit": "ms", "value_kind": "measurement", "currency": null},
  "source": {"issuer": "asm-replay", "source_url": null},
  "method": "independent_eval",
  "observed_at": "2026-06-01T02:00:00Z",
  "fetched_at": "2026-06-01T02:00:00Z",
  "expires_at": "2026-06-08T02:00:00Z",
  "scope": {"operation": "web.search", "region": "test", "account_plan": "basic", "task_profile": "official-docs/v1", "cache_mode": "disabled"},
  "strength": "independently_measured",
  "status": "expired",
  "snapshot": {"digest": "sha256:1111111111111111111111111111111111111111111111111111111111111111", "snapshot_ref": "replay://example-search/latency-old", "retention": "retained"}
}
